{
  "repository_id": "11111111-1111-4111-8111-111111111111",
  "generation_id": "44444444-4444-4444-8444-444444444444",
  "commit_sha": "0123456789abcdef0123456789abcdef01234567",
  "path": "src/retry.py",
  "start_line": 10,
  "end_line": 14,
  "content": "def retry() -> None:\n    pass\n",
  "truncated": false
}
